15:07:36.526288 IP 192.168.1.103.38540 > 192.168.1.102.1883: Flags [S], seq 2831207472, win 29200, options [mss 1460,sackOK,TS val 1132051 ecr 0,nop,wscale 7], length 0
15:07:36.526639 IP 192.168.1.102.1883 > 192.168.1.103.38540: Flags [S.], seq 4090998724, ack 2831207473, win 28960, options [mss 1460,sackOK,TS val 1529313 ecr 1132051,nop,wscale 7], length 0
15:07:36.526725 IP 192.168.1.103.38540 > 192.168.1.102.1883: Flags [.], ack 1, win 229, options [nop,nop,TS val 1132051 ecr 1529313], length 0
15:07:36.526829 IP 192.168.1.103.38540 > 192.168.1.102.1883: Flags [P.], seq 1:39, ack 1, win 229, options [nop,nop,TS val 1132051 ecr 1529313], length 38
15:07:36.527050 IP 192.168.1.102.1883 > 192.168.1.103.38540: Flags [.], ack 39, win 227, options [nop,nop,TS val 1529313 ecr 1132051], length 0
15:07:36.527896 IP 192.168.1.102.1883 > 192.168.1.103.38540: Flags [P.], seq 1:5, ack 39, win 227, options [nop,nop,TS val 1529313 ecr 1132051], length 4
15:07:36.527920 IP 192.168.1.103.38540 > 192.168.1.102.1883: Flags [.], ack 5, win 229, options [nop,nop,TS val 1132051 ecr 1529313], length 0
15:07:36.528042 IP 192.168.1.103.38540 > 192.168.1.102.1883: Flags [P.], seq 39:64, ack 5, win 229, options [nop,nop,TS val 1132051 ecr 1529313], length 25
15:07:36.529209 IP 192.168.1.102.1883 > 192.168.1.103.38540: Flags [P.], seq 5:10, ack 64, win 227, options [nop,nop,TS val 1529313 ecr 1132051], length 5
15:07:36.560149 IP 192.168.1.103.38540 > 192.168.1.102.1883: Flags [.], ack 10, win 229, options [nop,nop,TS val 1132055 ecr 1529313], length 0
