15:07:43.869068 IP 192.168.1.102.1883 > 192.168.1.103.38540: Flags [P.], seq 10:42, ack 64, win 227, options [nop,nop,TS val 1530047 ecr 1132055], length 32
15:07:43.869145 IP 192.168.1.103.38540 > 192.168.1.102.1883: Flags [.], ack 42, win 229, options [nop,nop,TS val 1132785 ecr 1530047], length 0
15:07:44.899464 IP 192.168.1.102.1883 > 192.168.1.103.38540: Flags [P.], seq 42:74, ack 64, win 227, options [nop,nop,TS val 1530150 ecr 1132785], length 32
15:07:44.899523 IP 192.168.1.103.38540 > 192.168.1.102.1883: Flags [.], ack 74, win 229, options [nop,nop,TS val 1132888 ecr 1530150], length 0
15:07:45.929866 IP 192.168.1.102.1883 > 192.168.1.103.38540: Flags [P.], seq 74:106, ack 64, win 227, options [nop,nop,TS val 1530253 ecr 1132888], length 32
15:07:45.929936 IP 192.168.1.103.38540 > 192.168.1.102.1883: Flags [.], ack 106, win 229, options [nop,nop,TS val 1132991 ecr 1530253], length 0
15:07:46.960895 IP 192.168.1.102.1883 > 192.168.1.103.38540: Flags [P.], seq 106:138, ack 64, win 227, options [nop,nop,TS val 1530356 ecr 1132991], length 32
15:07:46.960937 IP 192.168.1.103.38540 > 192.168.1.102.1883: Flags [.], ack 138, win 229, options [nop,nop,TS val 1133095 ecr 1530356], length 0
15:07:47.991153 IP 192.168.1.102.1883 > 192.168.1.103.38540: Flags [P.], seq 138:170, ack 64, win 227, options [nop,nop,TS val 1530459 ecr 1133095], length 32
15:07:47.991217 IP 192.168.1.103.38540 > 192.168.1.102.1883: Flags [.], ack 170, win 229, options [nop,nop,TS val 1133198 ecr 1530459], length 0
15:07:49.021609 IP 192.168.1.102.1883 > 192.168.1.103.38540: Flags [P.], seq 170:202, ack 64, win 227, options [nop,nop,TS val 1530562 ecr 1133198], length 32
15:07:49.021682 IP 192.168.1.103.38540 > 192.168.1.102.1883: Flags [.], ack 202, win 229, options [nop,nop,TS val 1133301 ecr 1530562], length 0
15:07:50.051697 IP 192.168.1.102.1883 > 192.168.1.103.38540: Flags [P.], seq 202:234, ack 64, win 227, options [nop,nop,TS val 1530665 ecr 1133301], length 32
15:07:50.051732 IP 192.168.1.103.38540 > 192.168.1.102.1883: Flags [.], ack 234, win 229, options [nop,nop,TS val 1133404 ecr 1530665], length 0
15:07:51.082330 IP 192.168.1.102.1883 > 192.168.1.103.38540: Flags [P.], seq 234:266, ack 64, win 227, options [nop,nop,TS val 1530768 ecr 1133404], length 32
15:07:51.082400 IP 192.168.1.103.38540 > 192.168.1.102.1883: Flags [.], ack 266, win 229, options [nop,nop,TS val 1133507 ecr 1530768], length 0
15:07:52.112912 IP 192.168.1.102.1883 > 192.168.1.103.38540: Flags [P.], seq 266:298, ack 64, win 227, options [nop,nop,TS val 1530871 ecr 1133507], length 32
15:07:52.112985 IP 192.168.1.103.38540 > 192.168.1.102.1883: Flags [.], ack 298, win 229, options [nop,nop,TS val 1133610 ecr 1530871], length 0
15:07:53.143541 IP 192.168.1.102.1883 > 192.168.1.103.38540: Flags [P.], seq 298:331, ack 64, win 227, options [nop,nop,TS val 1530974 ecr 1133610], length 33
15:07:53.143589 IP 192.168.1.103.38540 > 192.168.1.102.1883: Flags [.], ack 331, win 229, options [nop,nop,TS val 1133713 ecr 1530974], length 0

